[
  {
    "name": "checked",
    "type": "boolean",
    "description": "Indicates whether the element is selected by default on page load.",
    "usage": "Do not change the value (i.e. presence) of this attribute with Javascript.",
    "elements": [
      "input[type=\"radio\"]",
      "input[type=\"checkbox\"]"
    ]
  },
  {
    "name": "aria-checked",
    "type": "enum",
    "description": "Indicates the current state of relevant form elements.",
    "elements": [
      "[role=\"checkbox\"]",
      "[role=\"option\"]",
      "[role=\"radio\"]",
      "[role=\"switch\"]"
    ],
    "values": {
      "true" : { "description": "The element is checked." },
      "false": { "description": "The element supports being checked but is not currently checked." },
      "mixed": { "description": "Indicates a mixed mode value for a tri-state checkbox or menuitemcheckbox." },
      "undefined": { "description": "The element does not support being checked." }
    }
  }
]
